{
  "kind": "placement",
  "nodes": 7,
  "r": 6,
  "unit": 14,
  "segments": [
    {
      "id": 1,
      "size": 16,
      "storage": [
        1,
        2,
        3,
        4,
        5,
        6
      ]
    },
    {
      "id": 2,
      "size": 16,
      "storage": [
        2,
        3,
        4,
        5,
        6,
        7
      ]
    },
    {
      "id": 3,
      "size": 16,
      "storage": [
        1,
        3,
        4,
        5,
        6,
        7
      ]
    },
    {
      "id": 4,
      "size": 16,
      "storage": [
        1,
        2,
        4,
        5,
        6,
        7
      ]
    },
    {
      "id": 5,
      "size": 16,
      "storage": [
        1,
        2,
        3,
        5,
        6,
        7
      ]
    },
    {
      "id": 6,
      "size": 16,
      "storage": [
        1,
        2,
        3,
        4,
        6,
        7
      ]
    },
    {
      "id": 7,
      "size": 16,
      "storage": [
        1,
        2,
        3,
        4,
        5,
        7
      ]
    }
  ]
}
